Topic_Num,Topic_Perc_Contrib,Keywords,Text
0.0,0.253,"sar, cov, ncov, pneumonia, pangolin, human, show, ratg, december, identification","In the late December of 2019, an epidemic pneumonia (announced recently as Corona Virus Disease (COVID-19)) outbreak in city of Wuhan in China and widely spreads all over the world. According to authoritative statistics, the COVID-19 has caused more than 40,000 laboratory-confirmed infections with more than 1000 deaths by 12 February 2020 and is still increasing. It was caused by a novel identified coronavirus 2019-nCoV (renamed this virus as severe acute respiratory syndrome coronavirus 2, SARS-CoV-2). Released complete genomes of 2019-nCoVs have helped rapid identification and diagnosis of the COVID-19. Currently, it is another key task to explore potential intermediate host of SARS-CoV-2, which is vital to control COVID-19 spread. To this end, we re-investigated published data from pangolin lung samples from which SARS-like coronaviruses were detected by Liu et. By both deep assembly and multiple phylogenetic analyses, we found genomic and evolutionary evidences of the occurrence of 2019-nCoV-like coronavirus (named as Pangolin-CoV) from dead Malayan Pangolins. Pangolin-CoV is 91.02% and 90.55% identical at the whole genome level to 2019-nCoV and BatCoV RaTG13, respectively. Pangolin-CoV is the lowest common ancestor of 2019-nCoV and RaTG13. The S1 protein of Pangolin-CoV is much more closely related to 2019-nCoV than RaTG13. Five key amino-acid residues involved in the interaction with human ACE2 are completely consistent between Pangolin-CoV and 2019-nCoV but four amino-acid mutations occur in RaTG13. It indicates Pangolin-CoV has similar pathogenic potential to 2019-nCoV, which would be helpful to trace the origin and probable intermediate host of 2019-nCoV."
1.0,0.2242,"study, review, detect, preprint, potential, peer, management, reproduction, method, basic","As of February 11, 2020, more than 43,000 cases of a novel coronavirus (2019–nCoV) have been reported worldwide. Using publicly available data regarding the transmissibility potential (i.e. basic reproduction number) of 2019–nCoV, we demonstrate that relevant preprint studies generated considerable search and news media interest prior to the publication of peer-reviewed studies in the same topic area. We then show that preprint estimate ranges for the basic reproduction number associated with 2019–nCoV overlap with those presented by peer-reviewed studies that were published at a later date. Taken together, we argue that preprints are capable of driving global discourse during public health crises; however, we recommend that a consensus-based approach – as we have employed here – be considered as a means of assessing the robustness of preprint findings prior to peer review."
2.0,0.2106,"epidemic, china, hubei_province, spread, predict, rapidly, parameter, feb, end, expect","Since the first case of new coronavirus (2019-nCoV) pneumonia appeared in Wuhan, the virus has spread very rapidly in China on December 31st, with Hubei Province having the most severe epidemic situation. As of 24:00 on February 2nd, the cumulative number of confirmed cases in Hubei Province has reached up to 11,177. In this paper, we select the epidemic situation in Hubei Province as the research object to establish the SEIQDR model of infectious diseases. The parameters are determined from the existing data to predict the trend of the cumulative number of confirmed diagnoses, and the parameters are adjusted according to the prevention and control measures as well as possible changes. In comparison with Guangdong Province, where the SARS epidemic originated, it was concluded that the new coronavirus epidemic far exceeds the SARS epidemic in terms of infection rate and deaths. But thanks to the timely and effective prevention and control measures taken by the country, currently the epidemic is under control, and we predict the end of the epidemic is about 60 days earlier than the SARS virus. The total number of confirmed diagnoses in Hubei Province is 26,701 (ranges from 24,355 to 32,406), and the rapid growth period is expected to be from January 27th to February 10, and the epidemic will grow slowly after February 22nd. The growth is expected to stop on March 30th (ranges from March 26th to April 19th)."
3.0,0.2059,"number, datum, report, cumulative, control, official, day, incidence, total, pneumonia","This paper uses new credible non-official sources of data to evaluate the incidence and impact of the novel coronavirus (COVID-19) outbreak in China. Based on the number of reported cremations and on reports of possibly more accurate numbers on cases that appeared briefly on Tencent and were suppressed, we have conducted a modeling study to estimate the incidence and other parameters of the outbreak, including the potential starting time. The numbers for cumulative cases, new cases per day, and cumulative deaths coming from the non-official data are all substantially higher by a factor of 5 to 10 (depending on the date of the data) than would be implied by the official Chinese government data. All sets of non-official data used here imply that the coronavirus outbreak began in October or late September 2019."
5.0,0.1249,"infection, low, diagnosis, important, key, cure, eosinophil, acid, type, laboratory","The novel coronavirus (2019-nCoV) outbreak in Wuhan city, Hunan Province, China in Dec 2019 and has rapidly spread to the other parts of China. It is important to know what has happened in this epidemic. We analyzed the epidemic curves of 2019-nCoV cases, in mainland China from Jan 23, 2020 to Feb 11, 2020. We found cumulative confirmed cases in this period increased in a fast speed in China. We also observed important disparities in cure ratio(%) and mortality across high-income and low-income areas. Finally, we observed important disparities in cure ratio (%) and mortality across seven regions. Effective prevention and control measures should be taken and the sustained transmission required full attention of public health."
6.0,0.089,"model, transmission, february, rapid, wuhan, case, outbreak, accord, pyroptosis, approach","We develop a mathematical model to provide epidemic predictions for the 2019-nCov epidemic in Wuhan, China. We use reported case data up to January 31, 2020 from the Chinese Center for Disease Control and Prevention and the Wuhan Municipal Health Commission to parameterize the model. From the parameterized model we identify the number of unreported cases. We then use the model to project the epidemic forward with varying level of public health interventions. The model predictions emphasize the importance of major public health interventions in controlling 2019-nCov epidemics."
7.0,0.163,"patient, clinical, illness, mild, image, fever, area, observe, dyspnea, ground","The infection rate of 2019-nCoV in the outpatients from the fever clinics was high and the majority of COVID-19 were mild cases. The highest nucleic acid detection rate for 2019-nCoV infection was observed in patients with muscle ache, followed by dyspnea. The combination of fever, lower accounts of eosinophils and the imaging features of ground-glass opacity in bilateral lungs might be a valuable indicator for 2019-nCoV infection."
8.0,0.2646,"medical, effective, base, service, research, logistic, treat, significant, temporary, network","The outbreak of an epidemic disease may impose significant treats on human being and may further lead to a global crisis. In order to effectively control epidemic spread, a responsive logistics service is of vital importance. Over the years, researches have been focused on the establishment and the operations of temporary logistics network for delivering medical service and allocating emergency resources. However, the research focus has not been given to the design of a temporary reverse logistics network for medical waste treatment in epidemic outbreak, which, if improperly treated, may accelerate disease spread and pose a significant risk on both medical staffs and patients. Therefore, this paper formulates a novel multi-objective multi-period mixed integer program for reverse logistics network design in epidemic outbreak, which aims at effective management of the exponentially increased medical waste and healthcare hazards within a very short period. The model is validated with a real-world case study based on the outbreak of the coronavirus disease 2019 (COVID-19) in Wuhan, China. Even through the uncertainty of the future tendency of the COVID-19 spread is very high at the time of this research, some general managerial implications can still be obtained based on quantitative analyses. Among other insights, the computational results suggest installing and operating temporary incinerators at proper locations may be an effective solution for managing the tremendous increase of medical waste during the COVID-19 outbreak in Wuhan."
9.0,0.3669,"high, virus, risk, spread, coronaviruse, influenza, cv, focus, immune, ace","Angiotensin-converting enzyme 2 (ACE2) has emerged as a key regulator of the renin-angiotensin system in cardiovascular (CV) disease and plays a pivotal role in coronaviruses and influenza viruses infections. The present review is primarily focused on the findings to indicate the role of ACE2 in the relationship between coronaviruses and influenza viruses with CV disease. It is postulated that the risk of coronavirus or influenza virus infection is high, at least partly, due to high ACE2 expression in population with high CV risk. Coronaviruses and influenza viruses vaccine usage in high CV risk population could be a potential strategy to prevent both CV disease and coronaviruses or influenza viruses infections."
10.0,0.3113,"country, global, risk, world, future, assessment, spatiotemporal, vulnerability, worldwide, information","An ongoing novel coronavirus SARS-CoV-2 pneumonia infection outbreak called COVID-19 started in Wuhan, Hubei Province, China, in December 2019. It both spread rapidly to all provinces in China and started spreading around the world quickly through international human movement from January 2020. Currently, the spatiotemporal epidemic transmission patterns, prediction models, and possible risk analysis for the future are insufficient for COVID-19 but we urgently need relevant information, particularly from the global perspective.

We have developed a novel two-stage simulation model to simulate the spatiotemporal changes in the number of COVID-19 cases and estimate the future worldwide risk. Based on the connectivity of countries to China and the country's medical and epidemic prevention capabilities, different scenarios are generated to analyze the possible transmission throughout the world and use this information to evaluate each country’s vulnerability to and the dynamic risk of COVID-19.

Countries’ vulnerability to the COVID-19 outbreak from China is calculated for 63 countries around the world. Taiwan, South Korea, Hong Kong, and Japan are the most vulnerable areas. The relationship between each country’s vulnerability and days before the first imported case occurred shows a very high exponential decrease. The cumulative number of cases in each country also has a linear relationship with vulnerability, which can compare and quantify the initial epidemic prevention capabilities to various countries’ management strategies. In total, 1,000 simulation results of future cases around the world are generated for the spatiotemporal risk assessment. According to the simulation results of this study, if there is no specific medicine for it, it will likely form a global pandemic. This method can be used as a preliminary risk assessment of the spatiotemporal spread for a new global epidemic."
11.0,0.1862,"find, include, psychological, intervention, factor, wuhan, social, conduct, level, information","Our study found more than one third of the medical staff suffered from insomnia symptoms during the COVID-19 outbreak. The related factors were including education level, isolation environment, social psychological worries about the COVID-19 outbreak, and occupation of doctor. Interventions of insomnia on medical staffs were needed considering different social psychological factors."
12.0,0.1174,"covid, renal, related, combination, ncp, ocular, protective, vital, convenient, japan","Conjunctiva may be a transmission way of COVID-19.And ocular conjunctival swabs in combination with PCR test could be a non-invasive,convenient and feasible diagnostic method for identifying the infection of COVID-19.Emphasis on the false-negative results is vital."
13.0,0.1028,"case, estimate, public, prediction, february, hubei, ongoing, negative, improve, recommend","The incubation period of COVID-19 is verified to be approximately 5-6 days. The first- and second-generation cases have been well controlled, and the daily number of third-generation cases is gradually decreasing. The epidemic reached a turning point in China except for Hubei on February 6. The control and prevention of cluster events may be the key to final victory."
14.0,0.1569,"severe, respiratory, mortality, acute, syndrome, method, situation, similar, treatment, relate","COVID-19 infection causes severe respiratory disease, similar to severe acute respiratory syndrome coronavirus, and is associated with ICU entry and high mortality. We have studied the origin, epidemiology, treatment methods and other aspects, according to the treatment plan formulated by Wuhan Union Hospital, certified by the Ministry of Health of China, we hope to develop an effective treatment method to reduce the mortality of the disease."
15.0,0.3632,"paper, virus, treatment, publish, january, journal, article, give, source, outbreak","The novel coronavirus (2019-nCoV) outbreak has been traced in China late 2019 and then was transmitted into more than 25 countries. A total of 49 papers have been published in 20 journals during the last January and current February. These papers tried to explain the source of virus, the transmission route, genomic map and the similarity to previous viruses as well as the pathogenesis, symptoms and treatment methods. The huge numbers of the articles which were published on 2019-nCoV make confusing for the readers, since many of the articles are addressed similar topics. In this paper a systematic analysis was conducted for the published articles. The finding of these papers were summarized. Moreover, the present paper aim to highlight the responses of scientists and Journals for the 2019-nCoV outbreak. This paper reviewed 49 peer viewed articles while hundreds article still in the preprint. It was appeared that the Lancet journal has the highest numbers of publications (29%) which given an early alarm for 2019-nCoV. The first paper suggested Baricitinib as potential treatment for 2019-nCoV acute respiratory disease was published on 3 February in the Lancet Journal. In 16 January 2020, the genomic characteristics of the virus was published, followed by several papers on the diagnostic of the virus, pathogenicity and symptoms was more clear on 29 January. The Nature Journal was the fist which given an alarm for the 2019-nCoV outbreak. In conclusion source of 2019-nCoV, treatment methods, as well as vaccines, pathogenicity of the virus in the patient with HIV or other virus infections, transmission to fetus in the pregnant women still need more investigation."
16.0,0.23,"measure, control, prevention, strong, point, individual, expose, infected, beijing, publication",Given that 2019-nCoV could be controlled under the strong prevention measures of what China has taken and it will take about three months. The confirmed infected individuals will still keep quick increasing for 14 days (approximately equal to the sum of exposed period and infection period) after the start time point of control. The strong prevention measures should be insisted until the epidemic Coronavirus. Other domestic places and overseas have confirmed infected individuals should take strong interventions immediately. Earlier strong prevention measures could efficiently stop the independent self-sustaining outbreaks in other cities globally.
17.0,0.1259,"disease, reduce, covid, index, onset, fatal, exceed, chinese, early, resource","The COVID-19 infection was a mass onset, with a strong concealment that is difficult to detect in the early stages, and early detection can reduce the harm of the disease. Due to traffic control and tight medical resources, the inability to treat in a timely manner will lead to worsening of the disease of elderly patients, and even fatal respiratory diseases."
18.0,0.1356,"highly, covid, start, present, medical, suspect, ggo, demonstrate, closure, crucial","The imaging pattern of multifocal patchy peripheral pure ground glass opacity (GGO), mixed GGO or consolidation predominant in the lower lung, with more extensive GGO than consolidation in CT scans within the first week of illness is highly suspicious of 2019-nCoV infection during the outbreak, which may be crucial for early treatment and prompt isolation."
19.0,0.1784,"city, time, work, range, nationwide, high, spring, trace, large, put","The rapid and intensive measures taken by the Chinese government brought Wuhan epidemic under preliminary control. Some factories have resumed work since February 11, 2020, which exist the potential to cause the epidemic to increase again nationwide. In particular, because of the Spring Festival, more than 100 million migrant workers have to rework and 200 million school students at all levels might open the spring semesters. Consequently, its impact on the coronavirus epidemic block should be stressed. The publicity and supervision department should strengthen these two special groups’ epidemic learning and education, monitor their itinerary through a big data platform, and control their health and travel status in real time. It is recommended that migrant workers should not resume their work earlier than Feb. 27, 2020 and the school semester should also postpone to Apr. 1, 2020 at the earliest since large population density of students and their concentrated living and learning place."
20.0,0.1943,"quarantine, provide, isolation, contact, close, infect, effect, fatality, process, longer","The January 2020 coronavirus outbreak has seen many countries plan to ‘self-isolate’ or quarantine people who have potentially come into contact with the infection. Decisions on how to apply quarantine should be based on best available evidence. We conducted a rapid review of the psychological impact of quarantine using three electronic databases. 3166 papers were found and 24 included in the review. The majority of reviewed studies reported negative psychological effects including post-traumatic stress symptoms, confusion and anger. Stressors included longer quarantine duration, infection fears, frustration, boredom, inadequate supplies, inadequate information, financial loss and stigma. Some suggested long-lasting effects. Where quarantine is deemed necessary, officials should quarantine for no longer than necessary; provide clear rationale for quarantine and information about protocols; and ensure sufficient supplies are provided. A"
21.0,0.085,"outbreak, increase, staff, analysis, epidemic, analyse, previous, decrease, set, restriction",Medical staffs who had previous contact with NCP patients exhibited increased psychological problems and perceived social support. The governments should provide psychological services for medical staffs in the front line under the serious epidemic threat.
22.0,0.2987,"prevent, support, capacity, effectively, exist, manage, emergency, strengthen, understand, readiness","Countries vary widely in terms of their capacity to prevent, detect and control outbreaks, which is underpinned by global variances in the strength of health systems to manage health emergencies. Half of all countries analysed in this study currently have in place operational readiness capacities which should enable an effective response to any potential health emergencies including 2019-nCoV. However, it is crucial to integrate/triangulate findings from local risk assessments to fully understand national readiness capacities in relation to 2019-nCoV. Some countries may require external support if cases are identified and the infection spreads rapidly within their borders. As part of the commitment to the IHR (2005) countries should be implementing capacity building action to strengthen their ability to effectively prevent and manage health emergencies and the application of data analysis can support focused targeting of critical gaps that currently exist. Commitment to IHR (2005) also involves collaboration between States Parties to improve capacities for preventing and managing health emergencies which should also be carried out to improve preparedness. This will strengthen global readiness to contain existing outbreaks including the ongoing international spread of 2019-nCoV."
23.0,0.3629,"test, pcr, rt, sample, screen, nucleic, lamp, detection, diagnostic, swab","Novel Corona virus (COVID-19 or 2019-nCoV) is an emerging global health concern that requires a rapid diagnostic test. Quantitative reverse transcription PCR (qRT-PCR) is currently the standard for COVID-19 detection; however, Reverse Transcription Loop-Mediated Isothermal Amplification (RT-LAMP) may allow for faster and cheaper field based testing at point-of-risk. The objective of this study was to develop a rapid screening diagnostic test that could be completed in under 30 minutes. Simulated patient samples were generated by spiking serum, urine, saliva, oropharyngeal swabs, and nasopharyngeal swabs with a portion of the COVID-19 nucleic sequence. The samples were tested using RT-LAMP as well as by conventional qRT-PCR. Specificity of the RT-LAMP was evaluated by also testing against other related coronaviruses. RT-LAMP specifically detected COVID-19 in simulated patient samples. This test was performed in under 30 minutes. This approach could be used for monitoring of exposed individuals or potentially aid with screening efforts in the field and potential ports of entry."
25.0,0.0763,"infection, result, early, stage, current, tool, key, associate, timely, hospitalization","Our early warning and protective actions for prevention are undoubtedly the most critical step during this unpredictable storm. Well consciousness to prevent and control infection, timely and decisive adoption and adjustment of protective measures are the key to protection for our IBD patients. Our experience provides inspirative encouragements and suggestions in current COVID-19 worldwide spread and future pandemic diseases."
26.0,0.2143,"health, develop, care, finding, associate, worker, depression, implement, princess, high","Our findings confirmed 2019-nCoV could easily spread through direct personal contact in a hospital setting and provided compelling evidence that health-care facilities worldwide need to be prepared for possible transmission of this novel coronavirus. Medical workers engaging in daily interaction with their fellow workers should be personally under effective protection against the infection. The health-care workers developing any possible associated symptoms should seek prompt medical attention and be duly isolated, thereby minimizing secondary transmission of 2019-nCoV in health-care associated outbreaks. Adequate protection against exposure to infected patients can effectively protect health-care workers from 2019-nCoV infection."
27.0,0.1609,"patient, system, age, person, identify, admission, transcription, week, characteristic, hope","In our investigation, it was obviously that the COVID-19 can spread through person to person. The main manifestations of the patients were mainly upper respiratory symptoms, and some of the patients were accompanied by symptoms of the digestive system. There was no significant age limit for the infectivity of the population, but elderly people were still vulnerable groups. Patients with diabetes were more likely to develop into severe patients, and the probability of admission to the ICU was significantly increased."
28.0,0.1355,"china, coronavirus, symptom, suggest, cell, people, significant, aim, domestic, continue","2019-nCoV is a novel coronavirus named in 2019. The number of people suffering from the virus kept increasing from China to the world. The initial infection characters of 2019-nCoV has been reported, including the symptoms and blood test results. Cell pyroptosis is a novel inflammatory form of programmed cell death, which has been largely studied recently. Here we noted that some of the 2019-nCoV results could be matched to the cell pyroptosis. This paper is aimed to discuss the relationship between 2019-nCoV infection and cell pyroptosis and put forward a potential hypothesis."
